Предложение,Название произведения,Номер автора
"Сменив исправного и расторопного старосту, коим крестьяне его (по их привычке) были недовольны, поручил он управление села старой своей ключнице, приобретшей его доверенность искусством рассказывать, истории.",Повести покойного Ивана Петровича Белкина,13
"Сия глупая старуха не умела никогда различить двадцатипятирублевой ассигнации от пятидесятирублевой; крестьяне, коим она всем была кума, ее вовсе не боялись; ими выбранный староста до того им потворствовал, плутуя заодно, что Иван Петрович принужден был отменить барщину и учредить весьма умеренный оброк; но и тут крестьяне, пользуясь его слабостию, на первый год выпросили себе нарочитую льготу, а в следующие более двух третей оброка платили орехами, брусникою и тому подобным; и тут были недоимки.",Повести покойного Ивана Петровича Белкина,13
"Быв приятель покойному родителю Ивана Петровича, я почитал долгом предлагать и сыну свои советы, и неоднократно вызывался восстановить прежний, им упущенный, порядок.",Повести покойного Ивана Петровича Белкина,13
"Для сего, приехав однажды к нему, потребовал я хозяйственные книги, призвал плута старосту, и в присутствии Ивана Петровича занялся рассмотрением оных.",Повести покойного Ивана Петровича Белкина,13
"Молодой хозяин сначала стал следовать за мною со всевозможным вниманием и прилежностию; но как по счетам оказалось, что в последние два года число крестьян умножилось, число же дворовых птиц и домашнего скота нарочито уменьшилось, то Иван Петрович довольствовался сим первым сведением и далее меня не слушал, и в ту самую минуту, как я своими разысканиями и строгими допросами плута старосту в крайнее замешательство привел, и к совершенному безмолвию принудил, с великою моею досадою услышал я Ивана Петровича крепко храпящего на своем стуле.",Повести покойного Ивана Петровича Белкина,13
С тех пор перестал я вмешиваться в его хозяйственные распоряжения и передал его дела (как и он сам) распоряжению всевышнего.,Повести покойного Ивана Петровича Белкина,13
"Сие дружеских наших сношений нисколько впрочем не расстроило; ибо я, соболезнуя его слабости и пагубному нерадению, о общему молодым нашим дворянам, искренно любил Ивана Петровича да не льзя было и не любить молодого человека столь кроткого и честного.",Повести покойного Ивана Петровича Белкина,13
С своей стороны Иван Петрович оказывал уважение к моим летам и сердечно был ко мне привержен.,Повести покойного Ивана Петровича Белкина,13
"До самой кончины своей он почти каждый день со мною виделся, дорожа простою моею беседою, хотя ни привычками, ни образом мыслей, ни нравом, мы большею частию друг с другом не сходствовали.",Повести покойного Ивана Петровича Белкина,13
"Иван Петрович вел жизнь самую умеренную, избегал всякого рода излишеств; никогда не случалось мне видеть его навеселе (что в краю нашем за неслыханное чудо почесться может); к женскому же полу имел он великую склонность, но стыдливость была в нем истинно девическая.",Повести покойного Ивана Петровича Белкина,13
"*
Кроме повестей, о которых в письме вашем упоминать изволите, Иван Петрович оставил множество рукописей, которые частию у меня находятся, частию употреблены его ключницею на разные домашние потребы.",Повести покойного Ивана Петровича Белкина,13
"Таким образом прошлою зимою все окна ее флигеля заклеены были первою частию романа, которого он не кончил.",Повести покойного Ивана Петровича Белкина,13
"Вышеупомянутые повести были, кажется, первым его опытом.",Повести покойного Ивана Петровича Белкина,13
"Они, как сказывал Иван Петрович, большею частию справедливы и слышаны им от разных особ.",Повести покойного Ивана Петровича Белкина,13
"** Однако ж имена в них почти все вымышлены им самим, а названия сел и деревень заимствованы из нашего околодка, отчего и моя деревня где-то упомянута.",Повести покойного Ивана Петровича Белкина,13
"Сие произошло не от злого какого-либо намерения, но единственно от недостатка воображения.",Повести покойного Ивана Петровича Белкина,13
"Иван Петрович осенью 1828 года занемог простудною лихорадкою, обратившеюся в горячку, и умер, не смотря на неусыпные старания уездного нашего лекаря, человека весьма искусного, особенно в лечении закоренелых болезней, как то мозолей, и тому подобного.",Повести покойного Ивана Петровича Белкина,13
"Он скончался на моих руках на 30-м году от рождения, и похоронен в церкви села Горюхина близ покойных его родителей.",Повести покойного Ивана Петровича Белкина,13
"Иван Петрович был росту среднего, глаза имел серые, волоса русые, нос прямой; лицом был бел и худощав.",Повести покойного Ивана Петровича Белкина,13
"Вот, Милостивый Государь мой, всь, что мог я припомнить, касательно образа жизни, занятий, нрава и наружности покойного соседа и приятеля моего.",Повести покойного Ивана Петровича Белкина,13
"﻿Однажды бурмистр из дальней вотчины, Антон Васильев, окончив барыне Арине Петровне Головлевой доклад о своей поездке в Москву для сбора оброков с проживающих по паспортам крестьян и уже получив от нее разрешение идти в людскую, вдруг как-то таинственно замялся на месте, словно бы за ним было еще какое-то слово и дело, о котором он и решался и не решался доложить.",Господа Головлевы,14
"Арина Петровна, которая насквозь понимала не только малейшие телодвижения, но и тайные помыслы своих приближенных людей, немедленно обеспокоилась.",Господа Головлевы,14
– Что еще?,Господа Головлевы,14
"– спросила она, смотря на бурмистра в упор.",Господа Головлевы,14
"– Все-с, – попробовал было отвильнуть Антон Васильев.",Господа Головлевы,14
– Не ври!,Господа Головлевы,14
еще есть!,Господа Головлевы,14
по глазам вижу!,Господа Головлевы,14
"Антон Васильев, однако ж, не решался ответить и продолжал переступать с ноги на ногу.",Господа Головлевы,14
"– Сказывай, какое еще дело за тобой есть?",Господа Головлевы,14
"– решительным голосом прикрикнула на него Арина Петровна, – говори!",Господа Головлевы,14
не виляй хвостом… сумб переметная!,Господа Головлевы,14
"Арина Петровна любила давать прозвища людям, составлявшим ее административный и домашний персонал.",Господа Головлевы,14
"Антона Васильева она прозвала «переметной сумуй» не за то, чтоб он в самом деле был когда-нибудь замечен в предательстве, а за то, что был слаб на язык.",Господа Головлевы,14
"Имение, которым он управлял, имело своим центром значительное торговое село, в котором было большое число трактиров.",Господа Головлевы,14
"Антон Васильев любил попить чайку в трактире, похвастаться всемогуществом своей барыни и во время этого хвастовства незаметным образом провирался.",Господа Головлевы,14
"А так как у Арины Петровны постоянно были в ходу различные тяжбы, то частенько случалось, что болтливость доверенного человека выводила наружу барынины военные хитрости прежде, нежели они могли быть приведены в исполнение.",Господа Головлевы,14
"– Есть, действительно… – пробормотал наконец Антон Васильев.",Господа Головлевы,14
– Что?,Господа Головлевы,14
что такое?,Господа Головлевы,14
– взволновалась Арина Петровна.,Господа Головлевы,14
"Как женщина властная и притом в сильной степени одаренная творчеством, она в одну минуту нарисовала себе картину всевозможных противоречий и противодействий и сразу так усвоила себе эту мысль, что даже побледнела и вскочила с кресла.",Господа Головлевы,14
– Степан Владимирыч дом-то в Москве продали… – доложил бурмистр с расстановкой.,Господа Головлевы,14
– Ну?,Господа Головлевы,14
– Продали-с.,Господа Головлевы,14
– Почему?,Господа Головлевы,14
как?,Господа Головлевы,14
не мни!,Господа Головлевы,14
сказывай!,Господа Головлевы,14
– За долги… так нужно полагать!,Господа Головлевы,14
﻿Представьте себе такой случай: директор департамента призывает к себе столоначальника и говорит ему: «Любезный друг!,Господа ташкентцы,14
"я желал бы, чтоб вы открыли Америку».",Господа ташкентцы,14
"Я не берусь утверждать, чтоб столоначальник осмелился возразить, но он все-таки поймет, что открытие Америки совсем не его ума дело.",Господа ташкентцы,14
"Поэтому, всего вероятнее, он поступит так: разошлет во все места запросы, и затем постарается кончить это дело измором.",Господа ташкентцы,14
Но пускай тот же директор тому же столоначальнику скажет: «Любезный друг!,Господа ташкентцы,14
"я желал бы, чтоб вы всех этих Колумбов привели к одному знаменателю!»
Вы не успеете оглянуться, как Колумбы подлинно будут обузданы, а Америка так и останется неоткрытою.",Господа ташкентцы,14
Митрофаны не изменились.,Господа ташкентцы,14
"Как и во времена Фонвизина, они не хотят знать арифметики, потому что приход и расход сосчитает за них приказчик; они презирают географию, потому что кучер довезет их куда будет приказано; они небрегут историей, потому что старая нянька всякие истории на сон грядущий расскажет.",Господа ташкентцы,14
"Одно право они упорно отстаивают – это право обуздывать, право свободно простирать руками вперед.",Господа ташкентцы,14
"Митрофан на все способен, потому что на все готов.",Господа ташкентцы,14
"Он специалист по части гражданского судопроизводства, потому что занимал деньги и не отдавал оных.",Господа ташкентцы,14
"Он специалист по части уголовного судопроизводства, потому что давал затрещины и получал оные.",Господа ташкентцы,14
"Он специалист по части администрации, потому что знает такие ругательства, которые могут в одно мгновение опалить человека.",Господа ташкентцы,14
"Он специалист по части финансов, потому что все трактиры были свидетелями его финансовых операций.",Господа ташкентцы,14
"Он медик, потому что страдал секретными болезнями.",Господа ташкентцы,14
"Он акушер, потому что видал нагих женщин.",Господа ташкентцы,14
"Все профессии он изучил на своих собственных боках с такой основательностию, что даже получил название «выжиги».",Господа ташкентцы,14
"«Выжига» – это совсем не ругальный, а, скорее, деловой термин, означающий мужа совета.",Господа ташкентцы,14
"«Уж коли этакая „выжига“ не поможет, – говорят вам, указывая на X. или Z., – то дело твое пропащее».",Господа ташкентцы,14
"Вы обращаетесь к «выжиге», и, к изумлению вашему, он действительно помогает вам.",Господа ташкентцы,14
"Это до того удивительно, что вам непременно приходит на мысль, что и этот «выжига», и средства, которые он употребляет, и ваше дело, и вы сами – все это, взятое вместе, не стоит ломаного гроша.",Господа ташкентцы,14
"Все это какой-то безобразный мираж, способный поселить в душе не то отчаяние, не то презрение ко всему: к жизни, к себе самому…
Дайте «выжиге» рубль серебра, он заложит душу черту; дайте пять рублей – он сам сделается чертом.",Господа ташкентцы,14
"Ему и это сделать легко, потому что он один в целом мире знает, где найти черта и что у него просить.",Господа ташкентцы,14
"Это ходячий кошмар, который прокрадывается во все закоулки жизни и умеет до такой степени прочно внедриться всюду, что, несмотря на свою безазбучность, успевает сделаться необходимым человеком и подлинным мужем совета.",Господа ташкентцы,14
"И все благодаря лишь тому, что простота задач продолжает привлекать все сердца.",Господа ташкентцы,14
"Нам все еще чудится, что надо нечто разорить, чему-то положить предел, что-то стереть с лица земли.",Господа ташкентцы,14
"Не полезное что-нибудь сделать, а именно только разорить.",Господа ташкентцы,14
"Ежели признаться по совести, то это собственно мы и разумеем, говоря о процессе созидания.",Господа ташкентцы,14
Наши так называемые консерваторы суть расточители по преимуществу.,Господа ташкентцы,14
"Вселенная кажется им наполненною скоровоспламеняющимися элементами, состоящими из козней, крамол и измены.",Господа ташкентцы,14
﻿Однажды заяц перед волком провинился.,Самоотверженный заяц,14
"Бежал он, видите ли, неподалеку от волчьего логова, а волк увидел его и кричит: «Заинька!",Самоотверженный заяц,14
"остановись, миленький!» А заяц не только не остановился, а еще пуще ходу прибавил.",Самоотверженный заяц,14
"Вот волк в три прыжка его поймал да и говорит: «За то, что ты с первого моего слова не остановился, вот тебе мое решение: приговариваю я тебя к лишению живота посредством растерзания.",Самоотверженный заяц,14
"А так как теперь и я сыт, и волчиха моя сыта, и запасу у нас еще дней на пять хватит, то сиди ты вот под этим кустом и жди очереди.",Самоотверженный заяц,14
"А может быть… ха-ха… я тебя и помилую!»
Сидит заяц на задних лапках под кустом и не шевельнется.",Самоотверженный заяц,14
Только об одном думает: через столько-то суток и часов смерть должна прийти.,Самоотверженный заяц,14
"Глянет он в сторону, где находится волчье логово, а оттуда на него светящееся волчье око смотрит.",Самоотверженный заяц,14
А в другой раз и еще того хуже: выйдут волк с волчихой и начнут по полянке мимо него погуливать.,Самоотверженный заяц,14
"Посмотрят на него, и что-то волк волчихе по-волчьему скажет, и оба зальются: ха-ха!",Самоотверженный заяц,14
"И волчата тут же за ними увяжутся; играючи, к нему подбегут, ласкаются, зубами стучат… А у него, у зайца, сердце так и закатится!",Самоотверженный заяц,14
"Никогда он так не любил жизни, как теперь.",Самоотверженный заяц,14
"Был он заяц обстоятельный, высмотрел у вдовы, у зайчихи, дочку и жениться хотел.",Самоотверженный заяц,14
"Именно к ней, к невесте своей, он и бежал в ту минуту, как волк его за шиворот ухватил.",Самоотверженный заяц,14
"Ждет, чай, его теперь невеста, думает: изменил мне косой!",Самоотверженный заяц,14
"А может быть, подождала-подождала да и с другим… слюбилась… А может быть, и так: играла бедняжка в кустах, а тут ее волк… и слопал!..",Самоотверженный заяц,14
Думает это бедняга и слезами так и захлебывается.,Самоотверженный заяц,14
"Вот они, заячьи-то мечты!",Самоотверженный заяц,14
"жениться рассчитывал, самовар купил, мечтал, как с молодой зайчихой будет чай-сахар пить, и вместо всего — куда угодил!",Самоотверженный заяц,14
"А сколько, бишь, часов до смерти-то осталось?",Самоотверженный заяц,14
И вот сидит он однажды ночью и дремлет.,Самоотверженный заяц,14
"Снится ему, будто волк его при себе чиновником особых поручений сделал, а сам, покуда он по ревизиям бегает, к его зайчихе в гости ходит… Вдруг слышит, словно его кто-то под бок толккул.",Самоотверженный заяц,14
Оглядывается — ан это невестин брат.,Самоотверженный заяц,14
"— Невеста-то твоя помирает, — говорит.",Самоотверженный заяц,14
"— Прослышала, какая над тобой беда стряслась, и в одночасье зачахла.",Самоотверженный заяц,14
