Предложение,Название произведения,Номер автора
"Ну а коль прочтут роман и не увидят, не согласятся с примечательностью моего Алексея Федоровича?",Братья Карамазовы,8
"Говорю так, потому что с прискорбием это предвижу.",Братья Карамазовы,8
"Для меня он примечателен, но решительно сомневаюсь, успею ли это доказать читателю.",Братья Карамазовы,8
"Дело в том, что это пожалуй и деятель, но деятель неопределенный, не выяснившийся.",Братья Карамазовы,8
Впрочем странно бы требовать в такое время как наше от людей ясности.,Братья Карамазовы,8
"Одно, пожалуй, довольно несомненно: это человек странный, даже чудак.",Братья Карамазовы,8
"Но странность и чудачество скорее вредят, чем дают право на внимание, особенно когда все стремятся к тому, чтоб объединить частности и найти хоть какой-нибудь общий толк во всеобщей бестолочи.",Братья Карамазовы,8
Чудак же в большинстве случаев частность и обособление.,Братья Карамазовы,8
Не так ли?,Братья Карамазовы,8
"Вот если вы не согласитесь с этим последним тезисом, и ответите: ""Не так"" или ""не всегда так"", то я пожалуй и ободрюсь духом на счет значения героя моего Алексея Федоровича.",Братья Карамазовы,8
"Ибо не только чудак ""не всегда"" частность и обособление, а напротив бывает так, что он-то пожалуй и носит в себе иной раз сердцевину целого, а остальные люди его эпохи - все, каким-нибудь наплывным ветром, на время почему-то от него оторвались...
Я бы впрочем не пускался в эти весьма нелюбопытные и смутные объяснения и начал бы просто-за-просто без предисловия: понравится, так и так прочтут; но беда в том, что жизнеописание-то у меня одно, а романов два.",Братья Карамазовы,8
"Главный роман второй, - это деятельность моего героя уже в наше время, именно в наш теперешний текущий момент.",Братья Карамазовы,8
"Первый же роман произошел еще тринадцать лет назад, и есть почти даже и не роман, а лишь один момент из первой юности моего героя.",Братья Карамазовы,8
"Обойтись мне без этого первого романа невозможно, потому что многое во втором романе стало бы непонятным.",Братья Карамазовы,8
"Но таким образом еще усложняется первоначальное мое затруднение: если уж я, то-есть сам биограф, нахожу, что и одного-то романа может быть было бы для такого скромного и неопределенного героя излишне, то каково же являться с двумя и чем объяснить такую с моей стороны заносчивость?",Братья Карамазовы,8
"Теряясь в разрешении сих вопросов, решаюсь их обойти безо всякого разрешения.",Братья Карамазовы,8
"Разумеется, прозорливый читатель уже давно угадал, что я с самого начала к тому клонил, и только досадовал на меня, зачем я даром трачу бесплодные слова и драгоценное время.",Братья Карамазовы,8
"На это отвечу уже в точности: тратил я бесплодные слова и драгоценное время, во-первых, из вежливости, а во-вторых, из хитрости: ""все-таки, дескать, заране в чем-то предупредил"".",Братья Карамазовы,8
"Впрочем я даже рад тому, что роман мой разбился сам собою на два рассказа ""при существенном единстве целого"": познакомившись с первым рассказом, читатель уже сам определит: стоит ли ему приниматься за второй?",Братья Карамазовы,8
"Конечно никто ничем не связан, можно бросить книгу и с двух страниц первого рассказа, с тем чтоб и не раскрывать более.",Братья Карамазовы,8
"Но ведь есть такие деликатные читатели, которые непременно захотят дочитать до конца, чтоб не ошибиться в беспристрастном суждении, таковы например все русские критики.",Братья Карамазовы,8
Так вот пред такими-то все-таки сердцу легче: несмотря на всю их аккуратность и добросовестность все-таки даю им самый законный предлог бросить рассказ на первом эпизоде романа.,Братья Карамазовы,8
Ну вот и все предисловие.,Братья Карамазовы,8
"Я совершенно согласен, что оно лишнее, но так как оно уже написано, то пусть и останется.",Братья Карамазовы,8
"﻿В конце ноября, в оттепель, часов в девять утра, поезд Петербургско-Варшавской железной дороги на всех парах подходил к Петербургу.",Идиот,8
"Было так сыро и туманно, что насилу рассвело; в десяти шагах, вправо и влево от дороги, трудно было разглядеть хоть что-нибудь из окон вагона.",Идиот,8
"Из пассажиров были и возвращавшиеся из-за границы; но более были наполнены отделения для третьего класса, и все людом мелким и деловым, не из очень далека.",Идиот,8
"Все, как водится, устали, у всех отяжелели за ночь глаза, все назяблись, все лица были бледножелтые, под цвет тумана.",Идиот,8
"В одном из вагонов третьего класса, с рассвета, очутились друг против друга, у самого окна, два пассажира, - оба люди молодые, оба почти налегке, оба не щегольски одетые, оба с довольно замечательными физиономиями, и оба пожелавшие, наконец, войти друг с другом в разговор.",Идиот,8
"Если б они оба знали один про другого, чем они особенно в эту минуту замечательны, то, конечно, подивились бы, что случай так странно посадил их друг против друга в третьеклассном вагоне петербургско-варшавского поезда.",Идиот,8
"Один из них был небольшого роста, лет двадцати семи, курчавый и почти черноволосый, с серыми, маленькими, но огненными глазами.",Идиот,8
"Нос его был широки сплюснут, лицо скулистое; тонкие губы беспрерывно складывались в какую-то наглую, насмешливую и даже злую улыбку; но лоб его был высок и хорошо сформирован и скрашивал неблагородно развитую нижнюю часть лица.",Идиот,8
"Особенно приметна была в этом лице его мертвая бледность, придававшая всей физиономии молодого человека изможденный вид, несмотря на довольно крепкое сложение, и вместе с тем что-то страстное, до страдания, не гармонировавшее с нахальною и грубою улыбкой и с резким, самодовольным его взглядом.",Идиот,8
"Он был тепло одет, в широкий, мерлушечий, черный, крытый тулуп, и за ночь не зяб, тогда как сосед его принужден был вынести на своей издрогшей спине всю сладость сырой, ноябрьской русской ночи, к которой, очевидно, был не приготовлен.",Идиот,8
"На нем был довольно широкий и толстый плащ без рукавов и с огромным капюшоном, точь-в-точь как употребляют часто дорожные, по зимам, где-нибудь далеко за границей, в Швейцарии, или, например, в Северной Италии, не рассчитывая, конечно, при этом и на такие концы по дороге, как от Эйдкунена до Петербурга.",Идиот,8
"Но что годилось и вполне удовлетворяло в Италии, то оказалось не совсем пригодным в России.",Идиот,8
"Обладатель плаща с капюшоном был молодой человек, тоже лет двадцати шести или двадцати семи, роста немного повыше среднего, очень белокур, густоволос, со впалыми щеками и с легонькою, востренькою, почти совершенно белою бородкой.",Идиот,8
"Глаза его были большие, голубые и пристальные; во взгляде их было что-то тихое, но тяжелое, что-то полное того странного выражения, по которому некоторые угадывают с первого взгляда в субъекте падучую болезнь.",Идиот,8
"Лицо молодого человека было, впрочем, приятное, тонкое и сухое, но бесцветное, а теперь даже до-синя иззябшее.",Идиот,8
"В руках его болтался тощий узелок из старого, полинялого фуляра, заключавший, кажется, все его дорожное достояние.",Идиот,8
"На ногах его были толстоподошвенные башмаки с штиблетами, - все не по-русски.",Идиот,8
"Черноволосый сосед в крытом тулупе все это разглядел, частию от нечего делать, и, наконец, спросил с тою неделикатною усмешкой, в которой так бесцеремонно и небрежно выражается иногда людское удовольствие при неудачах ближнего:
- Зябко?",Идиот,8
И повел плечами.,Идиот,8
"- Очень, - ответил сосед с чрезвычайною готовностью, - и заметьте, это еще оттепель.",Идиот,8
"Что ж, если бы мороз?",Идиот,8
"Я даже не думал, что у нас так холодно.",Идиот,8
Отвык.,Идиот,8
- Из-за границы что ль?,Идиот,8
"- Да, из Швейцарии.",Идиот,8
- Фью!,Идиот,8
Эк ведь вас!..,Идиот,8
Черноволосый присвистнул и захохотал.,Идиот,8
Завязался разговор.,Идиот,8
"Готовность белокурого молодого человека в швейцарском плаще отвечать на все вопросы своего черномазого соседа была удивительная и без всякого подозрения совершенной небрежности, неуместности и праздности иных вопросов.",Идиот,8
"﻿В спектре этого рассказа основные линии - золотая, красная и лиловая, так как город полон куполов, революции и сирени.",Икс,9
"Революция и сирень - в полном цвету, откуда с известной степенью достоверности можно сделать вывод, что год 1919-й, а месяц май.",Икс,9
"Это майское утро начинается с того, что на углу Блинной и Розы Люксембург появляется процессия - по-видимому, религиозная: восемь духовных особ, хорошо известных всему городу.",Икс,9
"Но духовные особы размахивают не кадилами, а метлами, что переносит все действия из плана религии в план революции: это - просто нетрудовой элемент, отбывающий трудовую повинность на пользу народа.",Икс,9
"Вместо молитв, золотея, вздымаются к небу облака пыли, народ на тротуарах чихает, кашляет и торопится сквозь пыль.",Икс,9
"Еще только начало десятого, служба - в десять, но сегодня почему-то все вылетели спозаранок и гудят, как пчелы перед роеньем.",Икс,9
"В тот день (1919, 20/V ) все граждане в возрасте от восемнадцати до пятидесяти лет, за исключением самых нераскаянных буржуев, состояли на службе, и всех от восемнадцати до пятидесяти явно ждало сегодня что-то необычайное во всевозможных УЭПО, УЗКО, УОНО.",Икс,9
"Главное, что это было ""что-то"", что это был икс, а природа человеческая такова, что ее влекут именно иксы (этим прекрасно пользуются в алгебре и рассказах).",Икс,9
В данном случае икс произошел от раскаявшегося дьякона Индикоплева.,Икс,9
"Дьякон Индикоплев, публично покаявшийся, что он в течение десяти лет обманывал народ, естественно, пользовался теперь доверием и народа и власти.",Икс,9
"Иногда случалось даже, что он ловил рыбу с товарищем Стерлиговым из УИКа так было, например, вчера вечером.",Икс,9
"Оба глядели на поплавки, на золото-красно-лиловую воду и беседовали о головлях, о вождях революции, о свекольной патоке, о сбежавшем эсере Перепечко, об акулах империализма.",Икс,9
"Здесь - совершенно некстати - дьякон заметил, конфузливо прикрывшись ладонью:
- А у вас, товарищ Стерлигов, извиняюсь... штаники сзади... не то чтобы это самое, а вроде как бы...
Товарищ Стерлигов только почесал шубу на лице:
- Ладно, до завтра доживут!",Икс,9
"А завтра, должно быть, служащим прозодежду выдавать будут - из центра бумага пришла.",Икс,9
"Только это я вам по секрету...
Когда с двумя ершами дьякон возвращался домой, он по дороге, конечно, стукнул в окно телеграфисту Алешке и сказал ему - конечно, по секрету.",Икс,9
"А телеграфист Алешка, как вам известно, поэт, он написал уже восемь фунтов стихов - вон там, в сундуке лежат.",Икс,9
"Как поэт, он не счел себя вправе хранить тайну в душе: призвание поэта - открывать душу для всех.",Икс,9
И к утру все от восемнадцати до шестидесяти лет знали о прозодежде.,Икс,9
"Но никто не знал, что такое прозодежда.",Икс,9
"Всем ясно было одно: прозодежда есть нечто, ведущее свою родословную от фигового листа, т. е. нечто, прикрывающее наготу Адамов и украшающее наготу Ев.",Икс,9
"А общая площадь наготы тогда была значительно больше площади фиговых листьев - настолько, что, например, телеграфист Алешка давно уже ходил на службу в кальсонах, по средством олифы, сажи и сурика превращенных в серые, с красной полоской, непромокаемые брюки.",Икс,9
"Естественно поэтому, что для Алешки прозодежда воплощалась в брючный образ, но она же для красавицы Марфы расцветала в майскую розовую шляпу, для бывшего дьякона уплотнялась в сапоги - и так далее.",Икс,9
"Словом, прозодежда - это явно нечто, подобное протоплазме, первичной материи, из которой выросло все: и баобабы, и агнцы, и тигры, и шляпы, и эсеры, и сапоги, и пролетарии, и нераскаянные буржуи, раскаявшийся дьякон Индикоплев.",Икс,9
"Если вы рискнете сейчас вместе со мной нырнуть в пыльные облака на улице Люксембург, то сквозь чох и кашель вы явственно услышите то же самое, что слышу я: ""Дьякон... С дьяконом... Где дьякон?",Икс,9
"Не видали дьякона?""",Икс,9
"Только один дьякон, как опытный рыболов, мог вытащить этот зацепивший всех крючок-икс, с наживкой из прозодежды.",Икс,9
"Но дьякона здесь не было: дьякона надо было искать сейчас не в красной линии спектра, а в сиреневой, майской, любовной.",Икс,9
"Эта линия пролегает не по Розе Люксембург, а по Блинной.",Икс,9
"В самом конце Блинной, возле выкрашенного нежнейшей сиренево-розовой краской дома, стоит раскаявшийся дьякон.",Икс,9
"Вот он постучал в калитку, - через минуту мы услышим во дворе розовый Марфин голос: ""Кузьма Иваныч, это вы?""",Икс,9
"﻿Начиная с Галилея, все они перечислены в известной книге Г. Тиссандье (изд.",Мученики науки,9
"Павленкова, Спб, 1901 г.).",Мученики науки,9
"Но для наших дней книга эта, несомненно, уже устарела: там, например, нет ни слова о знаменитой француженке г-же Кюри, нет ни слова о нашей соотечественнице г-же Столпаковой.",Мученики науки,9
Памяти этой последней мы и посвящаем наш скромный труд.,Мученики науки,9
"Своим подвигом г-жа Столпакова, конечно, искупила все свои ошибки, по тем не менее мы не считаем себя вправе скрыть их от широких читательских масс.",Мученики науки,9
"Первой ошибкой Варвары Сергеевны Столпаковой было то, что родителей себе она выбрала крайне непредусмотрительно: у отца ее был известный всему уезду свеклосахарный завод.",Мученики науки,9
"Даже и это, в сущности, было на так еще непоправимо: Варваре Сергеевне стоило только отдать свое сердце любому из честных тружеников завода - и ее биография очистилась бы, как углем очищается сахар рафинад.",Мученики науки,9
"Вместо этого она совершила вторую ошибку: она вышла замуж за Столпакова, увлеченная его гвагдейскими рейтузами и исключительным талантом пускать кольца из табачного дыма.",Мученики науки,9
"Атлетические, монументальное сложение Варвары Сергеевны было причиной того, что третья ее ошибка произошла почти для нее незаметно, когда она в столпаковском лесу нагнулась сорвать гриб.",Мученики науки,9
"Нагнувшись, она ахнула, а через четверть часа в корзинке для грибов лежала эта ее ошибка - пола мужеского, в метрике записан под именем Ростислава.",Мученики науки,9
"Из других письменных материалов для истории сохранился также еще один документ, составленный в день отбытия Столпакова-отца на германский фронт.",Мученики науки,9
"В этот день кучер Яков Бордюг привел из монастыря всем известную монашку Анну, и полковник Столпаков продиктовал ей:
- Пиши paсписку ""Я, нижеподписавшаяся, монашка Анна, получила от г-жи Столпаковой 10 (десять) рублей, за что обязуюсь класть ежедневно по три поклона за мужа ее, с ручательством, что таковой с войны вернется без каких-либо членовреждений и с производством в чин генерала"".",Мученики науки,9
