Предложение,Название произведения,Номер автора
﻿– Так ты приходи!,Гостинец,0
"– в третий раз попросил Сениста, и в третий раз Сазонка торопливо ответил:
– Приду, приду, ты не бойся.",Гостинец,0
"Еще бы не прийти, конечно прийду.",Гостинец,0
И снова они замолчали.,Гостинец,0
"Сениста лежал на спине, до подбородка укрытый серым больничным одеялом, и упорно смотрел на Сазонку; ему хотелось чтобы Сазонка подольше не уходил из больницы и чтобы своим ответным взглядом он еще раз подтвердил обещание не оставлять его в жертву одиночеству, болезни и страху.",Гостинец,0
"Сазонке же хотелось уйти, но он не знал, как это сделать без обиды для мальчика, шмурыгал носом, почтисползал со стула и опять садился плотно и решительно, как будто навсегда.",Гостинец,0
"Он бы еще посидел, если бы было о чем говорить; но говорить было не о чем, и мысли приходили глупые, от которыхстановилось смешно и стыдно.",Гостинец,0
"Так, его все время тянуло называть Сенисту по имени и отчеству – Семеном Ерофеевичем, что было отчаянно нелепо: Сениста был мальчишка-подмастерье, а Сазонка был солидным мастером и пьяницей и Сазонкой звался только по привычке.",Гостинец,0
"И еще двух недель не прошло с тех пор, как он дал Сенисте последний подзатыльник, и эт обыло очень дурно, но и об этом говорить тоже нельзя.",Гостинец,0
"Сазонка решительно начал сползать со стула, но не доведя дело до половины, так же решительно всполз назад и сказал не то в виде укоризны, не то то утешения:
– Такие вот дела.",Гостинец,0
"Болит, а?",Гостинец,0
"Сениста утвердительно качнул головой и тихо ответил:
Ну, ступай.",Гостинец,0
А то он бранить будет.,Гостинец,0
"– Это верно, – обрадовался Сазонка предлогу.",Гостинец,0
"– Он и то приказывал: ты, говорит, поскорее.",Гостинец,0
Отвезешь – и той же минутой назад.,Гостинец,0
И чтобы водки ни-ни.,Гостинец,0
"Вот, черт!",Гостинец,0
"Но вместе с сознанием, что он может теперь уйти каждую минуту, в сердце Сазонки вошла острая жалость к большеголовому Сенисте.",Гостинец,0
"К жалости призывала вся необычная обстановка: тесный ряд кроватей с бледными, хмурыми людьми; воздух, до последней частицы испорченный запахом лекарств и испарениями больного человеческого тела; чувство собственной силы и здоровья.",Гостинец,0
"И, уже не избегая просительного взгляда, Сазонка наклонился к Сенисте и твердо повторил:
– Ты, Семен... Сеня, не бойся.",Гостинец,0
Приду.,Гостинец,0
"Как ослобонюсь, так и к тебе.",Гостинец,0
Разве мы не люди?,Гостинец,0
Господи!,Гостинец,0
Тоже и у нас понятие есть.,Гостинец,0
Милый!,Гостинец,0
Веришь мне аль нет?,Гостинец,0
"И с улыбкой на почерневших, запекшихся губах Сениста отвечал:
– Верю.",Гостинец,0
– Вот!,Гостинец,0
"﻿Осип Абрамович, парикмахер, поправил на груди посетителя грязную простынку, заткнул ее пальцами за ворот и крикнул отрывисто и резко:
- Мальчик, воды!",Девять рассказов,0
"Посетитель, рассматривавший в зеркало свою физиономию с тою обостренною внимательностью и интересом, какие являются только в парикмахерской, замечал, что у него на подбородке прибавился еще один угорь, и с неудовольствием отводил глаза, попадавшие прямо на худую, маленькую ручонку, которая откуда-то со стороны протягивалась к подзеркальнику и ставила жестянку с горячей водой.",Девять рассказов,0
"Когда он поднимал глаза выше, то видел отражение парикмахера, странное и как.",Девять рассказов,0
"будто косое, и подмечал быстрый и грозный взгляд, который тот бросал вниз на чью-то голову, и безмолвное движение его губ от неслышного, но выразительного шепота.",Девять рассказов,0
"Если его брил не сам хозяин Осип Абрамович, а кто-нибудь из подмастерьев, Прокопий или Михаила, то шепот становился громким и принимал форму неопределенной угрозы:
- Вот, погоди!",Девять рассказов,0
"Это значило, что мальчик недостаточно быстро подал воду и его ждет наказание.",Девять рассказов,0
"""Так их и следует"", - думал посетитель, кривя голову набок и созерцая у самого своего носа большую потную руку, у которой три пальца были оттопырены, а два другие, липкие и пахучие, нежно прикасались к щеке и подбородку, пока туповатая бритва с неприятным скрипом снимала мыльную пену и жесткую щетину бороды.",Девять рассказов,0
"В этой парикмахерской, пропитанной скучным запахом дешевых духов, полной надоедливых мух и грязи, посетитель был нетребовательный: швейцары, приказчики, иногда мелкие служащие или рабочие, часто аляповато-красивые, но подозрительные молодцы, с румяными щеками, тоненькими усиками и наглыми маслянистыми глазками.",Девять рассказов,0
"Невдалеке находился квартал, заполненный домами дешевого разврата.",Девять рассказов,0
"Они господствовали над этою местностью и придавали ей особый характер чего-то грязного, беспорядочного и тревожного.",Девять рассказов,0
"Мальчик, на которого чаще всего кричали, назывался Петькой и был самым маленьким из всех служащих в заведении.",Девять рассказов,0
"Другой мальчик, Николка, насчитывал от роду тремя годами больше и скоро должен был перейти в подмастерья.",Девять рассказов,0
"Уже и теперь, когда в парикмахерскую заглядывал посетитель попроще, а подмастерья, в отсутствие хозяина, ленились работать, они посылали Николку стричь и смеялись, что ему приходится подниматься на цыпочки, чтобы видеть волосатый затылок дюжего дворника.",Девять рассказов,0
"Иногда посетитель обижался за испорченные волосы и поднимал крик, тогда подмастерья кричали на Николку, но не всерьез, а только для удовольствия окорначенного простака.",Девять рассказов,0
"Но такие случаи бывали редко, и Николка важничал и держался, как большой: курил папиросы, сплевывал через зубы, ругался скверными словами и даже хвастался Петьке, что пил водку, но, вероятно, врал.",Девять рассказов,0
"Вместе с подмастерьями он бегал на соседнюю улицу посмотреть крупную драку, и, когда возвращался оттуда, счастливый и смеющийся, Осип Абрамович давал ему две пощечины: по одной на каждую щеку.",Девять рассказов,0
"Петьке было десять лет; он не курил, не пил водки и не ругался, хотя знал очень много скверных слов, и во всех этих отношениях завидовал товарищу.",Девять рассказов,0
"Когда не было посетителей и Прокопий, проводивший где-то бессонные ночи и днем спотыкавшийся от желания спать, приваливался в темном углу за перегородкой, а Михаила читал ""Московский листок"" и среди описания краж и грабежей искал знакомого имени кого-нибудь из обычных посетителей, - Петька и Николка беседовали.",Девять рассказов,0
"Последний всегда становился добрее, оставаясь вдвоем, и объяснял ""мальчику"", что значит стричь под польку, бобриком или с пробором.",Девять рассказов,0
"Иногда они садились на окно, рядом с восковым бюстом женщины, у которой были розовые щеки, стеклянные удивленные глаза и редкие прямые ресницы, - и смотрели на бульвар, где жизнь начиналась с раннего утра.",Девять рассказов,0
"Деревья бульвара, серые от пыли, неподвижно млели под горячим, безжалостным солнцем и давали такую же серую, не охлаждающую тень.",Девять рассказов,0
"На всех скамейках сидели мужчины и женщины, грязно и странно одетые, без платков и шапок, как будто они тут и жили и у них не было другого дома.",Девять рассказов,0
"Были лица равнодушные, злые или распущенные, но на всех на них лежала печать крайнего утомления и пренебрежения к окружающему.",Девять рассказов,0
"Часто чья-нибудь лохматая голова бессильно клонилась на плечо, и тело невольно искало простора для сна, как у третьеклассного пассажира, проехавшего тысячи верст без отдыха, но лечь было негде.",Девять рассказов,0
"По дорожкам расхаживал с палкой ярко-синий сторож и смотрел, чтобы кто-нибудь не развалился на скамейке или не бросился на траву, порыжевшую от солнца, но такую мягкую, такую прохладную.",Девять рассказов,0
"Женщины, всегда одетые более чисто, даже с намеком на моду, были все как будто на одно лицо и одного возраста, хотя иногда попадались совсем старые или молоденькие, почти дети.",Девять рассказов,0
"Все они говорили хриплыми, резкими голосами, бранились, обнимали мужчин так просто, как будто были на бульваре совсем одни, иногда тут же пили водку и закусывали.",Девять рассказов,0
"Случалось, пьяный мужчина бил такую же пьяную женщину; она падала, поднималась и снова падала; но никто не вступался за нее.",Девять рассказов,0
"Зубы весело скалились, лица становились осмысленнее и живее, около дерущихся собиралась толпа; но когда приближался ярко-синий сторож, все лениво разбредались по своим местам.",Девять рассказов,0
"И только побитая женщина плакала и бессмысленно ругалась; ее растрепанные волосы волочились по песку, а полуобнаженное тело, грязное и желтое при дневном свете, цинично и жалко выставлялось наружу.",Девять рассказов,0
﻿Над всей жизнью Василия Фивейского тяготел суровый и загадочный рок.,Жизнь Василия Фивейского,0
"Точно проклятый неведомым проклятием, он с юности нес тяжелое бремя печали, болезней и горя, и никогда не заживали на сердце его кровоточащие раны.",Жизнь Василия Фивейского,0
"Среди людей он был одинок, словно планета среди планет, и особенный, казалось, воздух, губительный и тлетворный, окружал его, как невидимое прозрачное облако.",Жизнь Василия Фивейского,0
"Сын покорного и терпеливого отца, захолустного священника, он сам был терпелив и покорен и долго не замечал той зловещей и таинственной преднамеренности, с какою стекались бедствия на его некрасивую, вихрастую голову.",Жизнь Василия Фивейского,0
"Быстро падал и медленно поднимался; снова падал и снова медленно поднимался, - и хворостинка за хворостинкой, песчинка за песчинкой трудолюбиво восстановлял он свой непрочный муравейник при большой дороге жизни.",Жизнь Василия Фивейского,0
"И когда он сделался священником, женился на хорошей девушке и родил от нее сына и дочь, то подумал, что все у него стало хорошо и прочно, как у людей, и пребудет таким навсегда.",Жизнь Василия Фивейского,0
"И благословил бога, так как верил в него торжественно и просто: как иерей и как человек с незлобивой душою.",Жизнь Василия Фивейского,0
"И случилось это на седьмой год его благополучия, в знойный июльский полдень: пошли деревенские ребята купаться, и с ними сын о. Василия, тоже Василий и такой же, как он, черненький и тихонький.",Жизнь Василия Фивейского,0
И утонул Василий.,Жизнь Василия Фивейского,0
"Молодая попадья, прибежавшая на берег с народом, навсегда запомнила простую и страшную картину человеческой смерти: и тягучие, глухие стуки своего сердца, как будто каждый удар его был последним; и необыкновенную прозрачность воздуха, в котором двигались знакомые, простые, но теперь обособленные и точно отодранные от земли фигуры людей; и оборванность смутных речей, когда каждое сказанное слово круглится в воздухе и медленно тает среди новых нарождающихся слов.",Жизнь Василия Фивейского,0
И на всю жизнь почувствовала она страх к ярким солнечным дням.,Жизнь Василия Фивейского,0
"Ей чудятся тогда широкие спины, залитые солнцем, босые ноги, твердо стоящие среди поломанных кочанов капусты, и равномерные взмахи чего-то белого, яркого, на дне которого округло перекатывается легонькое тельце, страшно близкое, страшно далекое и навеки чужое.",Жизнь Василия Фивейского,0
"И много времени спустя, когда Васю похоронили и трава выросла на его могиле, попадья все еще твердила молитву всех несчастных матерей: ""Господи, возьми мою жизнь, но отдай мое дитя!""",Жизнь Василия Фивейского,0
"Скоро и все в доме о. Василия стали бояться ярких летних дней, когда слишком светло горит солнце и нестерпимо блестит зажженная им обманчивая река.",Жизнь Василия Фивейского,0
"В такие дни, когда кругом радовались люди, животные и поля, все домочадцы о. Василия со страхом глядели на попадью, умышленно громко разговаривали и смеялись, а она вставала, ленивая и тусклая, смотрела в глаза пристально и странно, так что от взгляда ее отворачивались, и вяло бродила по дому, отыскивая какие-нибудь вещи: ключи, или ложку, или стакан.",Жизнь Василия Фивейского,0
"Все вещи, какие нужно, старались класть на виду, но она продолжала искать и искала все упорнее, все тревожнее, по мере того как все выше поднималось на небе веселое, яркое солнце.",Жизнь Василия Фивейского,0
"Она подходила к мужу, клала холодную руку на его плечо и вопросительно твердила:
- Вася!",Жизнь Василия Фивейского,0
А Вася?,Жизнь Василия Фивейского,0
"- Что, милая?",Жизнь Василия Фивейского,0
- покорно и безнадежно отвечал о. Василий и дрожащими загорелыми пальцами с грязными от земли нестрижеными ногтями оправлял ее сбившиеся волосы.,Жизнь Василия Фивейского,0
"Была она еще молода и красива, и на плохонькой домашней ряске мужа рука ее лежала как мраморная: белая и тяжелая.",Жизнь Василия Фивейского,0
"- Что, милая?",Жизнь Василия Фивейского,0
"Может быть, чайку бы выпила - ты еще не пила?",Жизнь Василия Фивейского,0
"- Вася, а Вася?",Жизнь Василия Фивейского,0
"- повторяла она вопросительно, снимала с плеча словно лишнюю и ненужную руку и снова искала все нетерпеливее, все беспокойнее.",Жизнь Василия Фивейского,0
"Из дома, обойдя все его неприбранные комнаты, она шла в сад, из сада во двор, потом опять в дом, а солнце поднималось все выше, и видно было сквозь деревья, как блестит тихая и теплая река.",Жизнь Василия Фивейского,0
"И шаг за шагом, цепко держась рукой за платье, угрюмо таскалась за попадьей дочь Настя, серьезная и мрачная, как будто и на ее шестилетнее сердце уже легла черная тень грядущего.",Жизнь Василия Фивейского,0
"Она старательно подгоняла свои маленькие шажки к крупным, рассеянным шагам матери, исподлобья, с тоскою оглядывала сад, знакомый, но вечно таинственный и манящий, - и свободная рука ее угрюмо тянулась к кислому крыжовнику и незаметно рвала, царапаясь об острые колючки.",Жизнь Василия Фивейского,0
"И от этих острых, как иглы, колючек и от кислого хрустящего крыжовника становилось еще скучнее и хотелось скулить, как заброшенному щенку.",Жизнь Василия Фивейского,0
"Когда солнце поднималось к зениту, попадья наглухо закрывала ставни в своей комнате и в темноте напивалась пьяная, в каждой рюмке черпая острую тоску и жгучее воспоминание о погибшем сыне.",Жизнь Василия Фивейского,0
"﻿Иисуса Христа много раз предупреждали, что Иуда из Кариота – человек очень дурной славы и его нужно остерегаться.",Иуда Искариот,0
"Одни из учеников, бывавшие в Иудее, хорошо знали его сами, другие много слыхали о нем от людей, и не было никого, кто мог бы сказать о нем доброе слово.",Иуда Искариот,0
