Предложение,Название произведения,Номер автора
"Запасов они не делали никаких и все, что попадалось, съедали тогда же; от них слышалась трубка и горелка иногда так далеко, что проходивший ми- мо ремесленник долго еще, остановившись, нюхал, как гончая собака, воздух.",Вий,4
"Рынок в это время обыкновенно только что начинал шевелиться, и торговки с бубликами, булками, арбузными семечками и маковниками дергали наподхват за полы тех, у которых полы были из тонкого сукна или какой-нибудь бумажной материи.",Вий,4
- Паничи!,Вий,4
паничи!,Вий,4
сюды!,Вий,4
сюды!,Вий,4
- говорили они со всех сторон.,Вий,4
"- Ось бублики, маковники, вертычки, буханци хороши!",Вий,4
"ей-богу, хороши!",Вий,4
на меду!,Вий,4
сама пекла!,Вий,4
"Другая, подняв что-то длинное, скрученное из теста, кричала:
- Ось сусулька!",Вий,4
"паничи, купите сусульку!",Вий,4
"- Не покупайте у этой ничего: смотрите, какая она скверная - и нос нехороший, и руки нечистые...
Но философов и богословов они боялись задевать, потому что философы и богословы всегда любили брать только на пробу и притом целою горстью
По приходе в семинарию вся толпа размещалась по классам, находившимся в низеньких, довольно, однако же, просторных комнатах с небольшими окнами, с широкими дверьми и запачканными скамьями.",Вий,4
"Класс наполнялся вдруг разноголосными жужжаниями: авдиторы выслушивали своих учеников; звонкий дискант грамматика попадал как раз в звон стекла, вставленного в маленькие окна, и стекло отвечало почти тем же звуком; в углу гудел ритор, которого рот и толстые губы должны бы принадлежать, по крайней мере, философии.",Вий,4
"Он гудел басом, и только слышно было издали: бу, бу, бу, бу... Авдиторы, слушая урок, смотрели одним глазом под скамью, где из кармана подчиненного бурсака выглядывала булка, или вареник, или семена из тыкв.",Вий,4
"Когда вся эта ученая толпа успевала приходить несколько ранее или когда знали, что профессора будут позже обыкновенного, тогда, со всеобщего согласия, замышляли бой, и в этом бою должны были участвовать все, даже и цензора, обязанные смотреть за порядком и нравственностию всего учащегося сословия.",Вий,4
"Два богослова обыкновенно решали, как происходить битве: каждый ли класс должен стоять за себя особенно или все должны разделиться на две половины: на бурсу и семинарию.",Вий,4
"Во всяком случае, грамматики начинали прежде всех, и как только вмешивались риторы, они уже бежали прочь и становились на возвышениях наблюдать битву.",Вий,4
"Потом вступала философия с черными длинными усами, а наконец и богословия, в ужасных шароварах и с претолстыми шеями.",Вий,4
"Обыкновенно оканчивалось тем, что богословия побивала всех, и философия, почесывая бока, была теснима в класс и помещалась отдыхать на скамьях.",Вий,4
"Профессор, входивший в класс и участвовавший когда-то сам в подобных боях, в одну минуту, по разгоревшимся лицам своих слушателей, узнавал, что бой был недурен, и в то время, когда он сек розгами по пальцам риторику, в другом классе другой профессор отделывал деревянными лопатками по рукам философию.",Вий,4
"С богословами же было поступаемо совершенно другим образом: им, по выражению профессора богословия, отсыпалось по мерке крупного гороху, что состояло в коротеньких кожаных канчуках.",Вий,4
В торжественные-дни и праздники семинаристы и бурсаки отправлялись по домам с вертепами.,Вий,4
"Иногда разыгрывали комедию, и в таком случае всегда отличался какой-нибудь богослов, ростом мало чем пониже киевской колокольни, представлявший Иродиаду или Пентефрию, супругу египетского царедворца.",Вий,4
﻿Сегодняшнего дня случилось необыкновенное приключение.,Записки сумасшедшего,4
"Я встал поутру довольно поздно, и когда Мавра принесла мне вычищенные сапоги, я спросил, который час.",Записки сумасшедшего,4
"Услышавши, что уже давно било десять, я поспешил поскорее одеться.",Записки сумасшедшего,4
"Признаюсь, я бы совсем не пошел в департамент, зная заранее, какую кислую мину сделает наш начальник отделения.",Записки сумасшедшего,4
"Он уже давно мне говорит: ""Что это у тебя, братец, в голове всегда ералаш такой?",Записки сумасшедшего,4
"Ты иной раз метаешься как угорелый, дело подчас так спутаешь, что сам сатана не разберет, в титуле поставишь маленькую букву, не выставишь ни числа, ни номера"".",Записки сумасшедшего,4
Проклятая цапля!,Записки сумасшедшего,4
"он, верно, завидует, что я сижу в директорском кабинете и очиниваю перья для его превосходительства.",Записки сумасшедшего,4
"Словом, я не пошел бы в департамент, если бы не надежда видеться с казначеем и авось-либо выпросить у этого жида хоть сколько-нибудь из жалованья вперед.",Записки сумасшедшего,4
Вот еще создание!,Записки сумасшедшего,4
"Чтобы он выдал когда-нибудь вперед за месяц деньги - господи боже мой, да скорее Страшный суд придет.",Записки сумасшедшего,4
"Проси, хоть тресни, хоть будь в разнужде, - не выдаст, седой черт.",Записки сумасшедшего,4
А на квартире собственная кухарка бьет его по щекам.,Записки сумасшедшего,4
Это всему свету известно.,Записки сумасшедшего,4
Я не понимаю выгод служить в департаменте.,Записки сумасшедшего,4
Никаких совершенно ресурсов.,Записки сумасшедшего,4
"Вот в губернском правлении, гражданских и казенных палатах совсем другое дело: там, смотришь, иной прижался в самом уголку и пописывает.",Записки сумасшедшего,4
"Фрачишка на нем гадкий, рожа такая, что плюнуть хочется, а посмотри ты, какую он дачу нанимает!",Записки сумасшедшего,4
"Фарфоровой вызолоченной чашки и не неси к нему: ""Это, говорит, докторский подарок""; а ему давай пару рысаков, или дрожки, или бобер рублей в триста.",Записки сумасшедшего,4
"С виду такой тихенький, говорит так деликатно: ""Одолжите ножичка починить перышко"", - а там обчистит так, что только одну рубашку оставит на просителе.",Записки сумасшедшего,4
"Правда, у нас зато служба благородная, чистота во всем такая, какой вовеки не видеть губернскому правлению: столы из красного дерева, и все начальники на вы.",Записки сумасшедшего,4
"Да, признаюсь, если бы не благородство службы, я бы давно оставил департамент.",Записки сумасшедшего,4
"Я надел старую шинель и взял зонтик, потому что шел проливной дождик.",Записки сумасшедшего,4
"На улицах не было никого; одни только бабы, накрывшись полами платья, да русские купцы под зонтиками, да курьеры попадались мне на глаза.",Записки сумасшедшего,4
Из благородных только наш брат чиновник попался мне.,Записки сумасшедшего,4
Я увидел его на перекрестке.,Записки сумасшедшего,4
"Я, как увидел его, тотчас сказал себе: ""Эге!",Записки сумасшедшего,4
"нет, голубчик, ты не в департамент идешь, ты спешишь вон за тою, что бежит впереди, и глядишь на ее ножки"".",Записки сумасшедшего,4
Что это за бестия наш брат чиновник!,Записки сумасшедшего,4
"Ей-богу, не уступит никакому офицеру: пройди какая-нибудь в шляпке, непременно зацепит.",Записки сумасшедшего,4
"﻿Городок Б. очень повеселел, когда начал в нем стоять *** кавалерийский полк.",Коляска,4
А до того времени было в нем страх скучно.,Коляска,4
"Когда, бывало, проезжаешь его и взглянешь на низенькие мазанные домики, которые смотрят на улицу до невероятности кисло, то... невозможно выразить, что делается тогда на сердце: тоска такая, как будто бы или проигрался, или отпустил некстати какую-нибудь глупость, – одним словом: нехорошо.",Коляска,4
"Глина на них обвалилась от дождя, и стены вместо белых сделались пегими; крыши большею частию крыты тростником, как обыкновенно бывает в южных городах наших; садики, для лучшего вида, городничий давно приказал вырубить.",Коляска,4
"На улицах ни души не встретишь, разве только петух перейдет чрез мостовую, мягкую, как подушка, от лежащей на четверть пыли, которая при малейшем дожде превращается в грязь, и тогда улицы городка Б. наполняются теми дородными животными, которых тамошний городничий называет французами.",Коляска,4
"Выставив серьёзные морды из своих ванн, они подымают такое хрюканье, что проезжающему остается только погонять лошадей поскорее.",Коляска,4
"Впрочем, проезжающего трудно встретить в городке Б. Редко, очень редко какой-нибудь помещик, имеющий одиннадцать душ крестьян, в нанковом сюртуке, тарабанит по мостовой в какой-то полубричке и полутележке, выглядывая из мучных наваленных мешков и пристегивая гнедую кобылу, вслед за которою бежит жеребенок.",Коляска,4
"Самая рыночная площадь имеет несколько печальный вид: дом портного выходит чрезвычайно глупо не всем фасадом, но углом; против него строится лет пятнадцать какое-то каменное строение о двух окнах; далее стоит сам по себе модный дощатый забор, выкрашенный серою краскою под цвет грязи, который, на образец другим строениям, воздвиг городничий во время своей молодости, когда не имел еще обыкновения спать тотчас после обеда и пить на ночь какой-то декокт, заправленный сухим крыжовником.",Коляска,4
"В других местах всё почти плетень; посреди площади самые маленькие лавочки; в них всегда можно заметить связку баранков, бабу в красном платке, пуд мыла, несколько фунтов горького миндалю, дробь для стреляния, демикотон и двух купеческих приказчиков, во всякое время играющих около дверей в свайку.",Коляска,4
"Но как начал стоять в уездном городке Б. кавалерийский полк, всё переменилось.",Коляска,4
"Улицы запестрели, оживились – словом, приняли совершенно другой вид.",Коляска,4
"Низенькие домики часто видели проходящего мимо ловкого, статного офицера с султаном на голове, шедшего к товарищу поговорить о производстве, об отличнейшем табаке, а иногда поставить на карточку дрожки, которые можно было назвать полковыми, потому что они, не выходя из полку, успевали обходить всех: сегодня катался в них майор, завтра они появлялись в поручиковой конюшне, а чрез неделю, смотри, опять майорский денщик подмазывал их салом.",Коляска,4
"Деревянный плетень между домами весь был усеян висевшими на солнце солдатскими фуражками; серая шинель торчала непременно где-нибудь на воротах; в переулках попадались солдаты с такими жесткими усами, как сапожные щетки.",Коляска,4
Усы эти были видны во всех местах.,Коляска,4
"Соберутся ли на рынке с ковшиками мещанки, из-за плеч их, верно, выглядывают усы.",Коляска,4
"На лобном месте солдат с усами, уж верно, мылил бороду какому-нибудь деревенскому пентюху, который только покряхтывал, выпуча глаза вверх.",Коляска,4
"Офицеры оживили общество, которое до того времени состояло только из судьи, жившего в одном доме с какою-то диаконицею, и городничего, рассудительного человека, но спавшего решительно весь день: от обеда до вечера и от вечера до обеда.",Коляска,4
"Общество сделалось еще многолюднее и занимательнее, когда переведена была сюда квартира бригадного генерала.",Коляска,4
"Окружные помещики, о которых существовании никто бы до того времени не догадался, начали приезжать почаще в уездный городок, чтобы видеться с господами офицерами, а иногда поиграть в банчик, который уже чрезвычайно темно грезился в голове их, захлопотанной посевами, жениными поручениями и зайцами.",Коляска,4
"Очень жаль, что не могу припомнить, по какому обстоятельству случилось бригадному генералу давать большой обед; заготовление к нему было сделано огромное: стук поваренных ножей на генеральской кухне был слышен еще близ городской заставы.",Коляска,4
"Весь рынок был забран совершенно для обеда, так что судья с своею диаконицею должен был есть одни только лепешки из гречневой муки да крахмальный кисель.",Коляска,4
Небольшой дворик генеральской квартиры был весь уставлен дрожками и колясками.,Коляска,4
Общество состояло из мужчин: офицеров и некоторых окружных помещиков.,Коляска,4
"Из помещиков более всех был замечателен Пифагор Пифагорович Чертокуцкий, один из главных аристократов Б... уезда, более всех шумевший на выборах и приезжавший туда в щегольском экипаже.",Коляска,4
Он служил прежде в одном из кавалерийских полков и был один из числа значительных и видных офицеров.,Коляска,4
"По крайней мере его видали на многих балах и собраниях, где только кочевал их полк; впрочем, об этом можно спросить у девиц Тамбовской и Симбирской губерний.",Коляска,4
"Весьма может быть, что он распустил бы и в прочих губерниях выгодную для себя славу, если бы не вышел в отставку по одному случаю, который обыкновенно называется неприятною историею: он ли дал кому-то в старые годы оплеуху, или ему дали ее, об этом наверное не помню, дело только в том, что его попросили выдти в отставку.",Коляска,4
"Впрочем, он этим ничуть не уронил своего весу: носил фрак с высокою талией на манер военного мундира, на сапогах шпоры и под носом усы, потому что без того дворяне могли бы подумать, что он служил в пехоте, которую он презрительно называл иногда пехтурой, а иногда пехонтарией.",Коляска,4
"Он бывал на всех многолюдных ярмарках, куда внутренность России, состоящая из мамок, детей, дочек и толстых помещиков, наезжала веселиться бричками, таратайками, тарантасами и такими каретами, какие и во сне никому не снились.",Коляска,4
"Он пронюхивал носом, где стоял кавалерийский полк, и всегда приезжал видеться с господами офицерами.",Коляска,4
"﻿В ворота гостиницы губернского города NN въехала довольно красивая рессорная небольшая бричка, в какой ездят холостяки: отставные подполковники, штабс-капитаны, помещики, имеющие около сотни душ крестьян, - словом, все те, которых называют господами средней руки.",Мертвые Души,4
"В бричке сидел господин, не красавец, но и не дурной наружности, ни слишком толст, ни слишком тонок; нельзя сказать, чтобы стар, однако ж и не так, чтобы слишком молод.",Мертвые Души,4
"Въезд его не произвел в городе совершенно никакого шума и не был сопровожден ничем особенным; только два русские мужика, стоявшие у дверей кабака против гостиницы, сделали кое-какие замечания, относившиеся, впрочем, более к экипажу, чем к сидевшему в нем.",Мертвые Души,4
"""Вишь ты, - сказал один другому, - вон какое колесо!",Мертвые Души,4
"что ты думаешь, доедет то колесо, если б случилось, в Москву или не доедет?""",Мертвые Души,4
"- ""Доедет"", - отвечал другой.",Мертвые Души,4
"""А в Казань-то, я думаю, не доедет?""",Мертвые Души,4
"- ""В Казань не доедет"", - отвечал другой.",Мертвые Души,4
"Этим разговор и кончился Да еще, когда бричка подъехала к гостинице, встретился молодой человек в белых канифасовых панталонах, весьма узких и коротких, во фраке с покушеньями на моду, из-под которого видна была манишка, застегнутая тульскою булавкою с бронзовым пистолетом.",Мертвые Души,4
